{
  "schemaVersion": "0.1.0",
  "implementation": "dotnet",
  "version": "1.0.0-beta.1",
  "protocolTag": "f0d4ad0b5f0010676a96719682ea3920f0b1baf3",
  "producedAt": "2026-09-04T02:15:55.928Z",
  "runLog": "conformance/results/dotnet-1.0.0-beta.1.json (Sakwala/affiant)",
  "failing": [
    {
      "id": "gate/substance-hollow-refused",
      "rules": [
        "GT-3"
      ],
      "disposition": "planned",
      "detail": "Substance is checked by the compliance harness at test time only. At run time the gate files whatever Affidavit it is handed, including one whose every field is tagged Empty -- a proposal that swears to nothing reaches a reviewer as though it swore to something.",
      "plannedFor": "1.0.0-beta.3",
      "oracle": true
    },
    {
      "id": "gate/substance-zero-field-refused",
      "rules": [
        "GT-3"
      ],
      "disposition": "planned",
      "detail": "Substance is checked by the compliance harness at test time only. At run time the gate files whatever Affidavit it is handed, including one whose every field is tagged Empty -- a proposal that swears to nothing reaches a reviewer as though it swore to something.",
      "plannedFor": "1.0.0-beta.3",
      "oracle": true
    },
    {
      "id": "gate/ttl-from-verdict",
      "rules": [
        "GT-4"
      ],
      "disposition": "planned",
      "detail": "The deadline is stamped from one global default before the policy chain runs, and a policy's verdict is a bare enum that cannot name one. A re-file with the same id broadcasts a card carrying a freshly computed deadline while the row keeps its original, so a reviewer can be shown a deadline the record does not hold.",
      "plannedFor": "1.0.0-beta.3",
      "oracle": true
    },
    {
      "id": "gate/ttl-from-policy-default",
      "rules": [
        "GT-4"
      ],
      "disposition": "planned",
      "detail": "The deadline is stamped from one global default before the policy chain runs, and a policy's verdict is a bare enum that cannot name one. A re-file with the same id broadcasts a card carrying a freshly computed deadline while the row keeps its original, so a reviewer can be shown a deadline the record does not hold.",
      "plannedFor": "1.0.0-beta.3",
      "oracle": true
    },
    {
      "id": "gate/ttl-from-gate-default",
      "rules": [
        "GT-4"
      ],
      "disposition": "planned",
      "detail": "The Evidence Card carries a docket id, an Affidavit, a deadline and prior amendments -- and no protocol version. A consumer cannot tell which version of the envelope it received, which is checked on every filing and so fails on every filing.",
      "plannedFor": "1.0.0-beta.3"
    },
    {
      "id": "gate/standing-order-by-the-book",
      "rules": [
        "GT-5",
        "AZ-1"
      ],
      "disposition": "planned",
      "detail": "The shipped default risk scorer never returns the grade the default Standing Order threshold demands, so a by-the-book Standing Order can never fire. The fix is written and green on branch build/risk-floor (Sakwala/affiant#53) and ships as 1.0.0-beta.1.1, which is NOT RELEASED: this row is planned rather than fixed, because \"fixed\" names a version a reader can install and this one cannot be installed yet. The row still fails at 1.0.0-beta.1 for what that release does not carry either way: the row a Standing Order approves has no attestation record and no execution state, and both are planned for 1.0.0-beta.3. No declarative fixture reaches the risk floor itself -- a fixture's declared policy binds to IApprovalPolicy, and the floor is in StandingOrderBase with the default scorer -- so what refutes it is the framework's own RiskConfigurationTests, which arrive with that change (Affiant.Policies.Tests, Sakwala/affiant#53).",
      "plannedFor": "1.0.0-beta.1.1",
      "oracle": true
    },
    {
      "id": "gate/standing-order-threshold-under",
      "rules": [
        "GT-5"
      ],
      "disposition": "planned",
      "detail": "Nothing on a Docket row says who or what approved the write. DocketEntry has twelve properties and an attestation is not among them, so an approved row carries no attributable record of who is answerable for it; a Standing Order's approver id is computed by StandingOrderBase and only written to the log.",
      "plannedFor": "1.0.0-beta.3"
    },
    {
      "id": "gate/standing-order-threshold-over",
      "rules": [
        "GT-5"
      ],
      "disposition": "planned",
      "detail": "A policy cannot declare a risk ceiling or the provenance sources it predicates on: IApprovalPolicy returns a bare requirement and nothing else. A Standing Order that should be held back -- over its threshold, on an unbound input, or with a mandatory field left empty -- fires anyway, and approves with no person present.",
      "plannedFor": "1.0.0-beta.3"
    },
    {
      "id": "gate/standing-order-unbound-input",
      "rules": [
        "PV-4"
      ],
      "disposition": "planned",
      "detail": "A policy cannot declare a risk ceiling or the provenance sources it predicates on: IApprovalPolicy returns a bare requirement and nothing else. A Standing Order that should be held back -- over its threshold, on an unbound input, or with a mandatory field left empty -- fires anyway, and approves with no person present.",
      "plannedFor": "1.0.0-beta.3"
    },
    {
      "id": "gate/standing-order-bound-input",
      "rules": [
        "PV-4",
        "AZ-1"
      ],
      "disposition": "planned",
      "detail": "Nothing on a Docket row says who or what approved the write. DocketEntry has twelve properties and an attestation is not among them, so an approved row carries no attributable record of who is answerable for it; a Standing Order's approver id is computed by StandingOrderBase and only written to the log.",
      "plannedFor": "1.0.0-beta.3"
    },
    {
      "id": "gate/multiparty-blocked",
      "rules": [
        "AZ-4"
      ],
      "disposition": "planned",
      "detail": "A row has no blocked marker, and a MultiParty verdict is routed to the same single-card branch as ReviewerConfirmation -- one approval satisfies a joint requirement. A referral is recorded as Deferred with nothing a card can show.",
      "plannedFor": "1.0.0-beta.3",
      "oracle": true
    },
    {
      "id": "gate/referral-blocked",
      "rules": [
        "AZ-4"
      ],
      "disposition": "planned",
      "detail": "A row has no blocked marker, and a MultiParty verdict is routed to the same single-card branch as ReviewerConfirmation -- one approval satisfies a joint requirement. A referral is recorded as Deferred with nothing a card can show.",
      "plannedFor": "1.0.0-beta.3"
    },
    {
      "id": "gate/coverage-refused-declared",
      "rules": [
        "CV-4",
        "AZ-4"
      ],
      "disposition": "fenced",
      "detail": "There is no coverage concept in the core. The only coverage refusal in the release is an internal wire-up audit inside the two adapter packages; nothing marks a filed row as blocked on coverage and there is no runtime refusal, so a tool the gate cannot intercept produces a proposal that looks like any other.",
      "fence": "Wire the tool catalogue through WithAffiant in Affiant.Extensions.AI or Affiant.AgentFramework: its HostedToolAudit refuses a tool list carrying provider-executed or hosted tools at start-up, before anything can be proposed. That closes the wire-up case only -- there is still no runtime refusal and no marker on a filed row.",
      "plannedFor": "1.0.0-beta.3",
      "oracle": true
    },
    {
      "id": "gate/update-previous-values",
      "rules": [
        "AF-3",
        "AF-1",
        "AF-2"
      ],
      "disposition": "fenced",
      "detail": "Every Affidavit the built-in projection produces is create-shaped: the entity id is hard-coded null and the previous value is null on every field, whatever the operation. A card for an update therefore cannot show what is changing, which is most of what a reviewer is being asked to check.",
      "fence": "Register a host IAffidavitProjection in place of the schema-driven default. The interface is public and the registration replaces it; a host projection can set the entity id and fill each field's previous value from its own store before the proposal is filed.",
      "plannedFor": "1.0.0-beta.3",
      "oracle": true
    },
    {
      "id": "gate/create-null-previous-values",
      "rules": [
        "AF-3"
      ],
      "disposition": "planned",
      "detail": "The Affidavit carries one confidence number and it is the mean over the non-Empty fields, so a mostly-empty Affidavit can report a high one. The record has no populatedConfidence and no empty-field count at all, so a reader cannot tell a confident record from a sparse one.",
      "plannedFor": "1.0.0-beta.3"
    },
    {
      "id": "gate/inference-conversation-and-inferred",
      "rules": [
        "GT-1",
        "PV-1",
        "PV-3",
        "AF-1",
        "AF-2"
      ],
      "disposition": "fenced",
      "detail": "Every Affidavit the built-in projection produces is create-shaped: the entity id is hard-coded null and the previous value is null on every field, whatever the operation. A card for an update therefore cannot show what is changing, which is most of what a reviewer is being asked to check.",
      "fence": "Register a host IAffidavitProjection in place of the schema-driven default. The interface is public and the registration replaces it; a host projection can set the entity id and fill each field's previous value from its own store before the proposal is filed.",
      "plannedFor": "1.0.0-beta.3"
    },
    {
      "id": "gate/threshold-without-scorer",
      "rules": [
        "CV-1",
        "GT-5"
      ],
      "disposition": "planned",